{
  "meta": {
    "schema_version": "0.1.0",
    "data_version": "0.1.0",
    "generated_for": "AI Creator Index V0.1",
    "snapshot_date": "2026-07-26",
    "methodology": {
      "recent_window_days": 92,
      "ranking_metric": "likes",
      "notes": "热度是一次性公开页面快照；深挖内容按相关性、热度、可溯源性与可复现空间综合选择。"
    },
    "evidence_rules": {
      "A": "找到原节目、官方页面、原仓库、官方活动记录，或主张直接来自原始笔记。",
      "B": "事件本身可核实，但具体观点来自转述或二手报道。",
      "C": "只确认到笔记或附件，尚未找到公开、稳定的原始出处。"
    }
  },
  "creators": [
    {
      "id": "xiaogai",
      "display_name": "小盖",
      "aliases": [],
      "bio": "从 X、播客、直播、演讲与官方发布中筛选高密度信息，再把长内容提炼成清晰中文判断的科技内容创作者。",
      "profile_summary": "中文科技圈的信息策展人：稳定完成“找材料、炼判断、落行动”，帮助读者缩短从发现信息到理解并使用信息的路径。",
      "media": {
        "avatar_path": "assets/creators/xiaogai/avatar.jpg",
        "profile_screenshot_path": "assets/creators/xiaogai/profile.png",
        "captured_at": "2026-07-26"
      },
      "topics": [
        "AI Coding",
        "Agent",
        "AI 产品",
        "播客",
        "提示词",
        "安全",
        "Vibe Coding"
      ],
      "platform_accounts": [
        {
          "platform": "xiaohongshu",
          "handle": "小盖",
          "platform_id": "26284956623",
          "profile_url": "https://xhslink.cn/m/4Huf2tL6sG3",
          "canonical_profile_url": "https://www.xiaohongshu.com/user/profile/6720c690000000001c01b883",
          "verified_at": "2026-07-26"
        }
      ],
      "stats_snapshot": {
        "captured_at": "2026-07-26",
        "public_post_count": 828,
        "earliest_public_post": "2025-01-14",
        "latest_public_post": "2026-07-23",
        "recent_window_days": 92,
        "recent_post_count": 103,
        "profile_social_proof": "1.4M次赞与收藏"
      },
      "editorial_takeaways": [
        "选材好：长期从 X、播客、直播、演讲和官方发布中寻找高密度原材料，而不是只追逐平台内的工具热点。",
        "提炼强：不平均复述长内容，而是抓住最有张力的问题，把它压成中文读者能记住、愿意转发的判断。",
        "有行动感：最终总会回到“这和普通人的工作、学习与选择有什么关系”，让信息变成可尝试的动作。"
      ],
      "content_analysis": {
        "positioning": "他不是工具说明书型账号，更接近中文科技圈的信息策展人。",
        "content_loop": [
          {
            "label": "会找",
            "explanation": "跨平台寻找正在产生新判断的高质量原材料。",
            "examples": [
              "X 上的 AI Builder 与新产品",
              "Lenny's Podcast 等产品播客",
              "Anthropic 官方访谈与研究",
              "直播、演讲和行业论坛"
            ]
          },
          {
            "label": "会炼",
            "explanation": "从长内容里抓住一个最有张力的问题，形成清晰、可记忆的中文判断。",
            "examples": [
              "Agency 比技能更耐久",
              "AI 是工具还是拐杖",
              "失败是下一次原型的反馈"
            ]
          },
          {
            "label": "会落地",
            "explanation": "把趋势和观点继续翻译成提示词、工作流或普通人可以马上尝试的动作。",
            "examples": [
              "先采访、后执行提示词",
              "Codex 非编程工作流",
              "从日常摩擦寻找 Vibe Coding 点子"
            ]
          }
        ],
        "reader_value": [
          "替读者跨平台寻找并筛选高密度信息。",
          "替读者完成“什么最值得记住”的判断。",
          "给出继续阅读、验证或亲手尝试的入口。"
        ],
        "source_channels": [
          {
            "channel": "X / AI Builder",
            "examples": [
              "OpenClaw Wrapper",
              "新产品与创业判断"
            ]
          },
          {
            "channel": "播客",
            "examples": [
              "Notion 产品负责人 Max Schoening",
              "James Dyson × David Senra"
            ]
          },
          {
            "channel": "官方访谈与研究",
            "examples": [
              "Anthropic 四名大学生访谈",
              "Anthropic Education Report"
            ]
          },
          {
            "channel": "直播、演讲与论坛",
            "examples": [
              "Tim × 天猫 AI 数码直播",
              "智能体创新与治理论坛"
            ]
          }
        ]
      },
      "last_verified_at": "2026-07-26"
    }
  ],
  "posts": [
    {
      "id": "xhs-openclaw-wrapper",
      "creator_id": "xiaogai",
      "platform": "xiaohongshu",
      "original_id": "699c650b0000000016009213",
      "original_url": "https://www.xiaohongshu.com/explore/699c650b0000000016009213",
      "title": "让我非常震撼的 OpenClaw 玩法",
      "format": "image_text",
      "published_at": "2026-02-23",
      "metrics": {
        "captured_at": "2026-07-26",
        "likes": 23524,
        "saves": 25411,
        "comments": 3948,
        "shares": 10156
      },
      "topics": [
        "Agent",
        "OpenClaw",
        "AI 产品",
        "创业"
      ],
      "selection_reason": "历史 AI 内容中热度与转发最强，且存在可验证的产品能力和可复现商业假设。",
      "focus": true
    },
    {
      "id": "xhs-interview-first",
      "creator_id": "xiaogai",
      "platform": "xiaohongshu",
      "original_id": "695a1e45000000001e0215f1",
      "original_url": "https://www.xiaohongshu.com/explore/695a1e45000000001e0215f1",
      "title": "最近调了一个非常好用的提示词",
      "format": "image_text",
      "published_at": "2026-01-04",
      "metrics": {
        "captured_at": "2026-07-26",
        "likes": 15171,
        "saves": 21292,
        "comments": 251,
        "shares": 3517
      },
      "topics": [
        "提示词",
        "工作流",
        "需求澄清"
      ],
      "selection_reason": "收藏意图极强，机制清晰，适合用 A/B 测试复现。",
      "focus": true
    },
    {
      "id": "xhs-dyson-senra",
      "creator_id": "xiaogai",
      "platform": "xiaohongshu",
      "original_id": "6937cc24000000001b022135",
      "original_url": "https://www.xiaohongshu.com/explore/6937cc24000000001b022135",
      "title": "被震到了，听过含金量最高的一期职场播客",
      "format": "image_text",
      "published_at": "2025-12-09",
      "metrics": {
        "captured_at": "2026-07-26",
        "likes": 5851,
        "saves": 5332,
        "comments": 74,
        "shares": 906
      },
      "topics": [
        "播客",
        "创业",
        "产品",
        "迭代"
      ],
      "selection_reason": "原节目稳定可溯源，适合连接 AI 原型迭代与创始人反馈回路。",
      "focus": true
    },
    {
      "id": "xhs-anthropic-students",
      "creator_id": "xiaogai",
      "platform": "xiaohongshu",
      "original_id": "6968e452000000001a02a18b",
      "original_url": "https://www.xiaohongshu.com/explore/6968e452000000001a02a18b",
      "title": "真心推荐大家都看看这期播客",
      "format": "video",
      "published_at": "2026-01-15",
      "metrics": {
        "captured_at": "2026-07-26",
        "likes": 5591,
        "saves": 6692,
        "comments": 107,
        "shares": 1618
      },
      "topics": [
        "播客",
        "教育",
        "Anthropic",
        "学习"
      ],
      "selection_reason": "有官方访谈与研究报告，可对照“代写式”和“学习式”AI 使用。",
      "focus": true
    },
    {
      "id": "xhs-tim-live",
      "creator_id": "xiaogai",
      "platform": "xiaohongshu",
      "original_id": "69f214a6000000003601a674",
      "original_url": "https://www.xiaohongshu.com/explore/69f214a6000000003601a674",
      "title": "Tim 昨晚的直播，特别有意思",
      "format": "video",
      "published_at": "2026-04-29",
      "metrics": {
        "captured_at": "2026-07-26",
        "likes": 8255,
        "saves": 3260,
        "comments": 120,
        "shares": 505
      },
      "topics": [
        "AI 视频",
        "AI 硬件",
        "直播"
      ],
      "selection_reason": "近92天热度第一，但完整直播回放未找到，适合作为 B 级案例。",
      "focus": true
    },
    {
      "id": "xhs-codex-ultimate",
      "creator_id": "xiaogai",
      "platform": "xiaohongshu",
      "original_id": "6a46195900000000220184df",
      "original_url": "https://www.xiaohongshu.com/explore/6a46195900000000220184df",
      "title": "Codex 的终极使用教程",
      "format": "image_text",
      "published_at": "2026-07-02",
      "metrics": {
        "captured_at": "2026-07-26",
        "likes": 8200,
        "saves": 9112,
        "comments": 184,
        "shares": 861
      },
      "topics": [
        "Codex",
        "知识工作",
        "AI Coding"
      ],
      "selection_reason": "近期收藏意图最强；官方定位可核验，但“连接 Kimi”未获官方支持验证。",
      "focus": true
    },
    {
      "id": "xhs-codex-eight-workflows",
      "creator_id": "xiaogai",
      "platform": "xiaohongshu",
      "original_id": "6a27cfd1000000003501fa83",
      "original_url": "https://www.xiaohongshu.com/explore/6a27cfd1000000003501fa83",
      "title": "总结下我使用 Codex 的 8 个高频场景",
      "format": "image_text",
      "published_at": "2026-06-09",
      "metrics": {
        "captured_at": "2026-07-26",
        "likes": 3145,
        "saves": 5113,
        "comments": 67,
        "shares": 823
      },
      "topics": [
        "Codex",
        "知识工作",
        "Skill",
        "自动化"
      ],
      "selection_reason": "三个开源 Skill 均可溯源，适合拆成连续复现实验。",
      "focus": true
    },
    {
      "id": "xhs-vibe-coding-ideas",
      "creator_id": "xiaogai",
      "platform": "xiaohongshu",
      "original_id": "6a4b9ce1000000001003ed1c",
      "original_url": "https://www.xiaohongshu.com/explore/6a4b9ce1000000001003ed1c",
      "title": "怎么找 Vibe Coding 的点子",
      "format": "image_text",
      "published_at": "2026-07-06",
      "metrics": {
        "captured_at": "2026-07-26",
        "likes": 2305,
        "saves": 1805,
        "comments": 42,
        "shares": 158
      },
      "topics": [
        "Vibe Coding",
        "产品",
        "创业"
      ],
      "selection_reason": "方法论可复现，但“知乎 AI Works”稳定公开入口尚未找到。",
      "focus": true
    },
    {
      "id": "xhs-notion-agency",
      "creator_id": "xiaogai",
      "platform": "xiaohongshu",
      "original_id": "6a313d7c0000000011012cdd",
      "original_url": "https://www.xiaohongshu.com/explore/6a313d7c0000000011012cdd",
      "title": "最近半年听过最好的一期 AI 播客",
      "format": "video",
      "published_at": "2026-06-16",
      "metrics": {
        "captured_at": "2026-07-26",
        "likes": 1902,
        "saves": 2337,
        "comments": 47,
        "shares": 500
      },
      "topics": [
        "播客",
        "Notion",
        "Agency",
        "Taste",
        "产品"
      ],
      "selection_reason": "原节目稳定可溯源，能从金句升级成可执行训练。",
      "focus": true
    },
    {
      "id": "xhs-agent-security",
      "creator_id": "xiaogai",
      "platform": "xiaohongshu",
      "original_id": "69f2f875000000003803561c",